module_id,cluster,raw_declarations,declaration_count,token_bag,source
extremal,solvable,Extremal Construction a b aut_of aut_dvdn act_morphism base_act act_dom gact gtype_unlockable ConstructionCont a b card Grp SpecializeExtremals p q modular_gtype dihedral_gtype semidihedral_gtype quaternion_kernel quaternion_unlock ExtremalTheory cyclic_pgroup_Aut_structure extremal_generators extremal_generators_facts ModularGroup m q r p_gt1 p_gt0 def_n def_p def_q def_r ltqm ltrq r_gt0 q_gt1 card_modular_group Grp_modular_group modular_group_generators generators_modular_group modular_group_structure DihedralGroup m def2 def_q Dihedral_extension card_ext_dihedral Grp_ext_dihedral card_dihedral Grp_dihedral Grp'_dihedral involutions_gen_dihedral Grp_2dihedral card_2dihedral card_semidihedral Grp_semidihedral Quaternion m q r GrpQ defQ card_quaternion Grp_quaternion eq_Mod8_D8 ExtremalStructure m q q_gt0 r r_gt0 def2qr generators_2dihedral generators_semidihedral generators_quaternion X Y yG xyG My Mxy dihedral2_structure quaternion_structure semidihedral_structure ExtremalClass extremal_group_type index_extremal_group_type enum_extremal_groups cancel_index_extremal_groups bound_extremal_groups extremal_class extremal2 dihedral_classP quaternion_classP semidihedral_classP odd_not_extremal2 modular_group_classP extremal2_structure maximal_cycle_extremal cyclic_SCN normal_rank1_structure odd_pgroup_rank1_cyclic prime_Ohm1P symplectic_type_group_structure,110,extremal construction aut of aut dvdn act morphism base act act dom gact gtype unlockable construction cont card grp specialize extremals modular gtype dihedral gtype semidihedral gtype quaternion kernel quaternion unlock extremal theory cyclic pgroup aut structure extremal generators extremal generators facts modular group gt1 gt0 def def def def ltqm ltrq gt0 gt1 card modular group grp modular group modular group generators generators modular group modular group structure dihedral group def2 def dihedral extension card ext dihedral grp ext dihedral card dihedral grp dihedral grp' dihedral involutions gen dihedral grp 2dihedral card 2dihedral card semidihedral grp semidihedral quaternion grp def card quaternion grp quaternion eq mod8 d8 extremal structure gt0 gt0 def2qr generators 2dihedral generators semidihedral generators quaternion yg xy my mxy dihedral2 structure quaternion structure semidihedral structure extremal class extremal group type index extremal group type enum extremal groups cancel index extremal groups bound extremal groups extremal class extremal2 dihedral class quaternion class semidihedral class odd not extremal2 modular group class extremal2 structure maximal cycle extremal cyclic scn normal rank1 structure odd pgroup rank1 cyclic prime ohm1p symplectic type group structure,v_file
hall,solvable,Hall SchurZassenhaus_split SchurZassenhaus_trans_sol SchurZassenhaus_trans_actsol Hall_exists_subJ HallCorollaries Hall_Frattini_arg InternalAction coprime_norm_cent coprime_Hall_exists coprime_Hall_trans norm_conj_cent strongest_coprime_quotient_cent coprime_norm_quotient_cent coprime_cent_mulG quotient_TI_subcent coprime_quotient_cent coprime_comm_pcore coprime_Hall_subset ExternalAction FullExtension injG injA external_action_im_coprime coGA' solG' nGA' ext_coprime_Hall_exists ext_coprime_Hall_trans ext_norm_conj_cent ext_coprime_Hall_subset ext_coprime_quotient_cent SylowSolvableAct sol_coprime_Sylow_exists sol_coprime_Sylow_trans sol_coprime_Sylow_subset,36,hall schur zassenhaus split schur zassenhaus trans sol schur zassenhaus trans actsol hall exists sub hall corollaries hall frattini arg internal action coprime norm cent coprime hall exists coprime hall trans norm conj cent strongest coprime quotient cent coprime norm quotient cent coprime cent mul quotient ti subcent coprime quotient cent coprime comm pcore coprime hall subset external action full extension inj inj external action im coprime co ga' sol g' ga' ext coprime hall exists ext coprime hall trans ext norm conj cent ext coprime hall subset ext coprime quotient cent sylow solvable act sol coprime sylow exists sol coprime sylow trans sol coprime sylow subset,v_file
abelian,solvable,AbelianDefs Ldiv exponent abelem is_abelem pElem pnElem nElem pmaxElem p_rank rank gen_rank Functors Ohm Mho Ohm_group Mho_group pdiv_p_elt OhmPredP Mho_p_elt ExponentAbelem LdivP dvdn_exponent expg_exponent exponentS exponentP trivg_exponent exponent1 exponent_dvdn exponent_gt0 pnat_exponent exponentJ exponent_witness exponent_cycle exponent_cyclic primes_exponent pi_of_exponent partn_exponentS exponent_Hall exponent_Zgroup cprod_exponent dprod_exponent sub_LdivT LdivT_J LdivJ sub_Ldiv group_Ldiv abelian_exponent_gen abelem_pgroup abelem_abelian abelem1 abelemE abelemP abelem_order_p cyclic_abelem_prime cycle_abelem exponent2_abelem prime_abelem abelem_cyclic abelemS abelemJ cprod_abelem dprod_abelem is_abelem_pgroup is_abelemP pElemP pElemS pElemI pElemJ pnElemP pnElemPcard card_pnElem pnElem0 pnElem_prime pnElemE pnElemS pnElemI pnElemJ abelem_pnElem card_p1Elem p1ElemE TIp1ElemP card_p1Elem_pnElem card_p1Elem_p2Elem p2Elem_dprodP nElemP nElem0 nElem1P nElemS nElemI def_pnElem pmaxElemP pmaxElem_exists pmaxElem_LdivP pmaxElemS pmaxElemJ grank_min grank_witness p_rank_witness p_rank_geP p_rank_gt0 p_rank1 logn_le_p_rank p_rank_le_logn p_rank_abelem p_rankS p_rankElem_max p_rankJ p_rank_Sylow p_rank_Hall p_rank_pmaxElem_exists rank1 p_rank_le_rank rank_gt0 rank_witness rank_pgroup rank_Sylow rank_abelem nt_pnElem rankJ rankS rank_geP MorphAbelem exponent_morphim morphim_LdivT morphim_Ldiv morphim_abelem morphim_pElem morphim_pnElem morphim_grank InjmAbelem defG exponent_injm injm_Ldiv injm_abelem injm_pElem injm_pnElem injm_nElem injm_pmaxElem injm_grank injm_p_rank injm_rank IsogAbelem exponent_isog isog_abelem isog_grank isog_p_rank isog_rank QuotientAbelem exponent_quotient quotient_LdivT quotient_Ldiv quotient_abelem quotient_pElem logn_quotient quotient_pnElem quotient_grank p_rank_quotient p_rank_dprod p_rank_p'quotient OhmProps Generic Ohm_sub Ohm1 Ohm_id Ohm_cont OhmS OhmE OhmEabelian Ohm_p_cycle Ohm_dprod Mho_sub Mho1 morphim_Mho Mho_cont MhoS MhoE MhoEabelian trivg_Mho Mho_p_cycle Mho_cprod Mho_dprod Ohm_igFun Ohm_gFun Ohm_mgFun Mho_igFun Mho_gFun Mho_mgFun char Ohm_char Ohm_normal Mho_char Mho_normal morphim_Ohm injm_Ohm isog_Ohm isog_Mho Ohm0 Ohm_leq OhmJ Mho0 Mho_leq MhoJ extend_cyclic_Mho Ohm1Eprime abelem_Ohm1 Ohm1_abelem Ohm1_id abelem_Ohm1P TI_Ohm1 Ohm1_eq1 meet_Ohm1 Ohm1_cent_max Ohm1_cyclic_pgroup_prime cyclic_pgroup_dprod_trivg piOhm1 Ohm1Eexponent p_rank_Ohm1 rank_Ohm1 p_rank_abelian rank_abelian_pgroup AbelianStructure abelian_splits abelem_splits abelian_type_subproof abelian_type_rec abelian_type abelian_type_dvdn_sorted abelian_type_gt1 abelian_type_sorted abelian_structure count_logn_dprod_cycle abelian_type_pgroup size_abelian_type mul_card_Ohm_Mho_abelian grank_abelian rank_cycle abelian_rank1_cyclic homocyclic homocyclic_Ohm_Mho Ohm_Mho_homocyclic abelem_homocyclic homocyclic1 Ohm1_homocyclicP abelian_type_homocyclic abelian_type_abelem max_card_abelian card_homocyclic abelian_type_dprod_homocyclic dprod_homocyclic exponent_dprod_homocyclic IsogAbelian isog_abelian_type eq_abelian_type_isog isog_abelem_card morphim_rank_abelian morphim_p_rank_abelian isog_homocyclic QuotientRank quotient_rank_abelian quotient_p_rank_abelian FimModAbelem fin_lmod_pchar_abelem fin_Fp_lmod_abelem fin_ring_pchar_abelem fin_lmod_char_abelem fin_ring_char_abelem,267,abelian defs ldiv exponent abelem is abelem elem pn elem elem pmax elem rank rank gen rank functors ohm mho ohm group mho group pdiv elt ohm pred mho elt exponent abelem ldiv dvdn exponent expg exponent exponent exponent trivg exponent exponent1 exponent dvdn exponent gt0 pnat exponent exponent exponent witness exponent cycle exponent cyclic primes exponent pi of exponent partn exponent exponent hall exponent zgroup cprod exponent dprod exponent sub ldiv ldiv ldiv sub ldiv group ldiv abelian exponent gen abelem pgroup abelem abelian abelem1 abelem abelem abelem order cyclic abelem prime cycle abelem exponent2 abelem prime abelem abelem cyclic abelem abelem cprod abelem dprod abelem is abelem pgroup is abelem elem elem elem elem pn elem pn elem pcard card pn elem pn elem0 pn elem prime pn elem pn elem pn elem pn elem abelem pn elem card p1elem p1elem ip1elem card p1elem pn elem card p1elem p2elem p2elem dprod elem elem0 elem1p elem elem def pn elem pmax elem pmax elem exists pmax elem ldiv pmax elem pmax elem grank min grank witness rank witness rank ge rank gt0 rank1 logn le rank rank le logn rank abelem rank rank elem max rank rank sylow rank hall rank pmax elem exists rank1 rank le rank rank gt0 rank witness rank pgroup rank sylow rank abelem nt pn elem rank rank rank ge morph abelem exponent morphim morphim ldiv morphim ldiv morphim abelem morphim elem morphim pn elem morphim grank injm abelem def exponent injm injm ldiv injm abelem injm elem injm pn elem injm elem injm pmax elem injm grank injm rank injm rank isog abelem exponent isog isog abelem isog grank isog rank isog rank quotient abelem exponent quotient quotient ldiv quotient ldiv quotient abelem quotient elem logn quotient quotient pn elem quotient grank rank quotient rank dprod rank p'quotient ohm props generic ohm sub ohm1 ohm id ohm cont ohm ohm ohm eabelian ohm cycle ohm dprod mho sub mho1 morphim mho mho cont mho mho mho eabelian trivg mho mho cycle mho cprod mho dprod ohm ig fun ohm fun ohm mg fun mho ig fun mho fun mho mg fun char ohm char ohm normal mho char mho normal morphim ohm injm ohm isog ohm isog mho ohm0 ohm leq ohm mho0 mho leq mho extend cyclic mho ohm1eprime abelem ohm1 ohm1 abelem ohm1 id abelem ohm1p ti ohm1 ohm1 eq1 meet ohm1 ohm1 cent max ohm1 cyclic pgroup prime cyclic pgroup dprod trivg pi ohm1 ohm1eexponent rank ohm1 rank ohm1 rank abelian rank abelian pgroup abelian structure abelian splits abelem splits abelian type subproof abelian type rec abelian type abelian type dvdn sorted abelian type gt1 abelian type sorted abelian structure count logn dprod cycle abelian type pgroup size abelian type mul card ohm mho abelian grank abelian rank cycle abelian rank1 cyclic homocyclic homocyclic ohm mho ohm mho homocyclic abelem homocyclic homocyclic1 ohm1 homocyclic abelian type homocyclic abelian type abelem max card abelian card homocyclic abelian type dprod homocyclic dprod homocyclic exponent dprod homocyclic isog abelian isog abelian type eq abelian type isog isog abelem card morphim rank abelian morphim rank abelian isog homocyclic quotient rank quotient rank abelian quotient rank abelian fim mod abelem fin lmod pchar abelem fin fp lmod abelem fin ring pchar abelem fin lmod char abelem fin ring char abelem,v_file
alt,solvable,SymAltDef Sym Sym_group sign_morph Alt Alt_group Alt_even Alt_subset Alt_normal Alt_norm n Alt_index card_Sym card_Alt Sym_trans Alt_trans aperm_faithful trivial_Alt_2 simple_Alt_3 not_simple_Alt_4 simple_Alt5_base Restrict T' rfd_funP rfd_fun rfdP rfd rfd_morph rfd_morphism rgd_fun rgdP rgd rfd_odd rfd_iso simple_Alt5 gen_tperm_circular_shift Perm_solvable solvable_AltF solvable_SymF,39,sym alt def sym sym group sign morph alt alt group alt even alt subset alt normal alt norm alt index card sym card alt sym trans alt trans aperm faithful trivial alt simple alt not simple alt simple alt5 base restrict t' rfd fun rfd fun rfd rfd rfd morph rfd morphism rgd fun rgd rgd rfd odd rfd iso simple alt5 gen tperm circular shift perm solvable solvable alt solvable sym,v_file
nilpotent,solvable,SeriesDefs lower_central_at upper_central_at PropertiesDefs nilpotent nil_class solvable NilpotentProps nilpotent1 nilpotentS nil_comm_properl nil_comm_properr centrals_nil LowerCentral lcn0 lcn1 lcnSn lcnSnS lcnE lcn2 lcn_group_set lower_central_at_group lcn_char lcn_normal lcn_sub lcn_norm lcn_subS lcn_normalS lcn_central lcn_sub_leq lcnS lcn_cprod lcn_dprod der_cprod der_dprod lcn_bigcprod lcn_bigdprod der_bigcprod der_bigdprod nilpotent_class lcn_nil_classP lcnP abelian_nil nil_class0 nil_class1 cprod_nil mulg_nil dprod_nil bigdprod_nil lcn_cont lcn_igFun lcn_gFun lcn_mgFun UpperCentralFunctor ucn_pmap ucn_group_set upper_central_at_group ucn_sub morphim_ucn ucn_igFun ucn_gFun ucn_pgFun ucn_char ucn_norm ucn_normal UpperCentral ucn0 ucnSn ucnE ucn_subS ucn_sub_geq ucn_central ucn_normalS ucn_comm ucn1 ucnSnR ucn_cprod ucn_dprod ucn_bigcprod ucn_bigdprod ucn_lcnP ucnP ucn_nil_classP ucn_id ucn_nilpotent nil_class_ucn MorphNil morphim_lcn injm_ucn morphim_nil injm_nil nil_class_morphim nil_class_injm QuotientNil quotient_ucn_add isog_nil isog_nil_class quotient_nil quotient_center_nil nil_class_quotient_center nilpotent_sub_norm nilpotent_proper_norm nilpotent_subnormal TI_center_nil meet_center_nil center_nil_eq1 cyclic_nilpotent_quo_der1_cyclic Solvable nilpotent_sol abelian_sol solvable1 solvableS sol_der1_proper derivedP MorphSol morphim_sol injm_sol QuotientSol isog_sol quotient_sol series_sol metacyclic_sol setXn setXn_sol,124,series defs lower central at upper central at properties defs nilpotent nil class solvable nilpotent props nilpotent1 nilpotent nil comm properl nil comm properr centrals nil lower central lcn0 lcn1 lcn sn lcn sn lcn lcn2 lcn group set lower central at group lcn char lcn normal lcn sub lcn norm lcn sub lcn normal lcn central lcn sub leq lcn lcn cprod lcn dprod der cprod der dprod lcn bigcprod lcn bigdprod der bigcprod der bigdprod nilpotent class lcn nil class lcn abelian nil nil class0 nil class1 cprod nil mulg nil dprod nil bigdprod nil lcn cont lcn ig fun lcn fun lcn mg fun upper central functor ucn pmap ucn group set upper central at group ucn sub morphim ucn ucn ig fun ucn fun ucn pg fun ucn char ucn norm ucn normal upper central ucn0 ucn sn ucn ucn sub ucn sub geq ucn central ucn normal ucn comm ucn1 ucn sn ucn cprod ucn dprod ucn bigcprod ucn bigdprod ucn lcn ucn ucn nil class ucn id ucn nilpotent nil class ucn morph nil morphim lcn injm ucn morphim nil injm nil nil class morphim nil class injm quotient nil quotient ucn add isog nil isog nil class quotient nil quotient center nil nil class quotient center nilpotent sub norm nilpotent proper norm nilpotent subnormal ti center nil meet center nil center nil eq1 cyclic nilpotent quo der1 cyclic solvable nilpotent sol abelian sol solvable1 solvable sol der1 proper derived morph sol morphim sol injm sol quotient sol isog sol quotient sol series sol metacyclic sol set xn set xn sol,v_file
commutator,solvable,derived_at DerivedBasics derg0 derg1 dergSn der_group_set derived_at_group Basic_commutator_properties conjg_mulR conjg_Rmul commMgJ commgMJ commMgR commgMR Hall_Witt_identity LeftComm commVg commXg RightComm cyz' commgV commgX LeftRightComm commXXg expMg_Rmul Commutator_properties commG1 comm1G commg_sub commg_norml commg_normr commg_norm commg_normal normsRl normsRr commg_subr commg_subl commg_subI quotient_cents2 quotient_cents2r sub_der1_norm sub_der1_normal sub_der1_abelian der1_min der_abelian commg_normSl commg_normSr commMGr commMG comm3G1P three_subgroup der1_joing_cycles commgAC comm_norm_cent_cent charR der_char der_sub der_norm der_normal der_subS der_normalS morphim_der dergS quotient_der derJ derG1P der_cont der_igFun der_gFun der_mgFun isog_der,71,derived at derived basics derg0 derg1 derg sn der group set derived at group basic commutator properties conjg mul conjg rmul comm mg commg mj comm mg commg mr hall witt identity left comm comm vg comm xg right comm cyz' commg commg left right comm comm xg exp mg rmul commutator properties comm g1 comm1g commg sub commg norml commg normr commg norm commg normal norms rl norms rr commg subr commg subl commg sub quotient cents2 quotient cents2r sub der1 norm sub der1 normal sub der1 abelian der1 min der abelian commg norm sl commg norm sr comm gr comm mg comm3g1p three subgroup der1 joing cycles commg ac comm norm cent cent char der char der sub der norm der normal der sub der normal morphim der derg quotient der der der g1p der cont der ig fun der fun der mg fun isog der,v_file
gfunctor,solvable,GFunctor object_map Definitions group_valued closed continuous iso_continuous continuous_is_iso_continuous pcontinuous pcontinuous_is_continuous hereditary pcontinuous_is_hereditary monotonic comp modulo ClassDefinitions iso_map map pmap mono_map pack_iso clone_iso clone clone_pmap clone_mono Exports apply iso_of_map map_of_pmap map_of_mono continuous_is_iso_continuous pcontinuous_is_continuous pcontinuous_is_hereditary FunctorGroup gFgroupset gFgroup gFmod_group IsoFunctorTheory gFsub gFsub_trans gF1 gFiso_cont gFchar gFnorm gFnorms gFnormal gFchar_trans gFnormal_trans gFnorm_trans injmF_sub injmF gFisom gFisog FunctorTheory gFcont morphimF PartialFunctorTheory BasicTheory gFhereditary gFunctorI pmorphimF gFid Modulo gFmod_closed gFmod_cont gFmod_igFun gFmod_gFun gFmod_hereditary gFmod_pgFun MonotonicFunctorTheory gFunctorS Composition gFcomp_closed gFcomp_cont gFcomp_igFun gFcomp_gFun gFcompS gFcomp_mgFun GFunctorExamples idGfun idGfun_closed idGfun_cont idGfun_monotonic bgFunc_id gFunc_id mgFunc_id trivGfun trivGfun_cont trivGfun_igFun trivGfun_gFun trivGfun_pgFun,91,functor object map definitions group valued closed continuous iso continuous continuous is iso continuous pcontinuous pcontinuous is continuous hereditary pcontinuous is hereditary monotonic comp modulo class definitions iso map map pmap mono map pack iso clone iso clone clone pmap clone mono exports apply iso of map map of pmap map of mono continuous is iso continuous pcontinuous is continuous pcontinuous is hereditary functor group fgroupset fgroup fmod group iso functor theory fsub fsub trans f1 fiso cont fchar fnorm fnorms fnormal fchar trans fnormal trans fnorm trans injm sub injm fisom fisog functor theory fcont morphim partial functor theory basic theory fhereditary functor pmorphim fid modulo fmod closed fmod cont fmod ig fun fmod fun fmod hereditary fmod pg fun monotonic functor theory functor composition fcomp closed fcomp cont fcomp ig fun fcomp fun fcomp fcomp mg fun functor examples id gfun id gfun closed id gfun cont id gfun monotonic bg func id func id mg func id triv gfun triv gfun cont triv gfun ig fun triv gfun fun triv gfun pg fun,v_file
primitive_action,solvable,PrimitiveDef imprimitivity_system primitive Primitive trans_prim_astab prim_trans_norm NactionDef n_act n_act_is_action n_act_action NTransitive dtuple_on ntransitive dtuple_onP n_act_dtuple NTransitveProp card_uniq_tuple n_act0 dtuple_on_add dtuple_on_add_D1 dtuple_on_subset n_act_add ntransitive0 ntransitive_weak ntransitive1 ntransitive_primitive NTransitveProp1 stab_ntransitive stab_ntransitiveI,29,primitive def imprimitivity system primitive primitive trans prim astab prim trans norm naction def act act is action act action transitive dtuple on ntransitive dtuple on act dtuple transitve prop card uniq tuple act0 dtuple on add dtuple on add d1 dtuple on subset act add ntransitive0 ntransitive weak ntransitive1 ntransitive primitive transitve prop1 stab ntransitive stab ntransitive,v_file
pgroup,solvable,PgroupDefs pgroup psubgroup p_group p_elt constt Hall pHall Syl Sylow PgroupProps trivgVpdiv prime_subgroupVti pgroupE sub_pgroup eq_pgroup eq_p'group pgroupNK pi_pgroup pi_p'group pi'_p'group p'groupEpi pgroup_pi partG_eq1 pgroupP pgroup1 pgroupS oddSg odd_pgroup_odd card_pgroup properG_ltn_log pgroupM pgroupJ pgroup_p p_groupP pgroup_pdiv coprime_p'group card_Hall pHall_sub pHall_pgroup pHallP pHallE coprime_mulpG_Hall coprime_mulGp_Hall eq_in_pHall eq_pHall eq_p'Hall pHallNK subHall_Hall subHall_Sylow pHall_Hall Hall_pi HallP sdprod_Hall coprime_sdprod_Hall_l coprime_sdprod_Hall_r compl_pHall compl_p'Hall sdprod_normal_p'HallP sdprod_normal_pHallP pHallJ2 pHallJnorm pHallJ HallJ psubgroupJ p_groupJ SylowJ p_Sylow pHall_subl Hall1 p_group1 Sylow1 SylowP p_elt_exp mem_p_elt p_eltM_norm p_eltM p_elt1 p_eltV p_eltX p_eltJ sub_p_elt eq_p_elt p_eltNK eq_constt consttNK cycle_constt consttV constt1 consttJ p_elt_constt consttC p'_elt_constt order_constt consttM consttX constt1P constt_p_elt sub_in_constt prod_constt max_pgroupJ comm_sub_max_pgroup normal_sub_max_pgroup norm_sub_max_pgroup sub_pHall Hall_max pHall_id psubgroup1 Cauchy sub_normal_Hall mem_normal_Hall uniq_normal_Hall NormalHall normal_max_pgroup_Hall setI_normal_Hall Morphim morphim_pgroup morphim_odd pmorphim_pgroup morphim_p_index morphim_pHall pmorphim_pHall morphim_Hall morphim_pSylow morphim_p_group morphim_Sylow morph_p_elt morph_constt Pquotient quotient_pgroup quotient_pHall quotient_odd pquotient_pgroup pquotient_pHall ltn_log_quotient InnerAutCyclicPgroup logn_quotient_cent_cyclic_pgroup p'group_quotient_cent_prime PcoreDef pcore pcore_group PseriesDefs pcore_mod pcore_mod_group pseries pseries_group_set pseries_group PCoreProps pcore_psubgroup pcore_pgroup pcore_sub pcore_sub_Hall pcore_max pcore_pgroup_id pcore_normal normal_Hall_pcore eq_Hall_pcore sub_Hall_pcore mem_Hall_pcore sdprod_Hall_pcoreP sdprod_pcore_HallP pcoreJ MorphPcore morphim_pcore pcoreS pcore_igFun pcore_gFun pcore_pgFun pcore_char PcoreMod pcore_mod_sub quotient_pcore_mod morphim_pcore_mod pcore_mod_res pcore_mod1 pseries_rcons pseries_subfun pseries_sub morphim_pseries pseriesS pseries_igFun pseries_gFun pseries_pgFun pseries_char pseries_normal pseriesJ pseries1 pseries_pop pseries_pop2 pseries_sub_catl quotient_pseries pseries_norm2 pseries_sub_catr quotient_pseries2 quotient_pseries_cat pseries_catl_id pseries_char_catl pseries_catr_id pseries_char_catr pcore_modp pquotient_pcore trivg_pcore_quotient pseries_rcons_id EqPcore sub_in_pcore sub_pcore eq_in_pcore eq_pcore pcoreNK eq_p'core sdprod_Hall_p'coreP sdprod_p'core_HallP pcoreI bigcap_p'core coprime_pcoreC TI_pcoreC pcore_setI_normal Injm injm_pgroup injm_pelt injm_pHall injm_pcore injm_pseries Isog isog_pgroup isog_pcore isog_pseries,227,pgroup defs pgroup psubgroup group elt constt hall hall syl sylow pgroup props trivg vpdiv prime subgroup vti pgroup sub pgroup eq pgroup eq p'group pgroup nk pi pgroup pi p'group pi' p'group p'group epi pgroup pi part eq1 pgroup pgroup1 pgroup odd sg odd pgroup odd card pgroup proper ltn log pgroup pgroup pgroup group pgroup pdiv coprime p'group card hall hall sub hall pgroup hall hall coprime mulp hall coprime mul gp hall eq in hall eq hall eq p'hall hall nk sub hall hall sub hall sylow hall hall hall pi hall sdprod hall coprime sdprod hall coprime sdprod hall compl hall compl p'hall sdprod normal p'hall sdprod normal hall hall j2 hall jnorm hall hall psubgroup group sylow sylow hall subl hall1 group1 sylow1 sylow elt exp mem elt elt norm elt elt1 elt elt elt sub elt eq elt elt nk eq constt constt nk cycle constt constt constt1 constt elt constt constt p' elt constt order constt constt constt constt1p constt elt sub in constt prod constt max pgroup comm sub max pgroup normal sub max pgroup norm sub max pgroup sub hall hall max hall id psubgroup1 cauchy sub normal hall mem normal hall uniq normal hall normal hall normal max pgroup hall set normal hall morphim morphim pgroup morphim odd pmorphim pgroup morphim index morphim hall pmorphim hall morphim hall morphim sylow morphim group morphim sylow morph elt morph constt pquotient quotient pgroup quotient hall quotient odd pquotient pgroup pquotient hall ltn log quotient inner aut cyclic pgroup logn quotient cent cyclic pgroup p'group quotient cent prime pcore def pcore pcore group pseries defs pcore mod pcore mod group pseries pseries group set pseries group core props pcore psubgroup pcore pgroup pcore sub pcore sub hall pcore max pcore pgroup id pcore normal normal hall pcore eq hall pcore sub hall pcore mem hall pcore sdprod hall pcore sdprod pcore hall pcore morph pcore morphim pcore pcore pcore ig fun pcore fun pcore pg fun pcore char pcore mod pcore mod sub quotient pcore mod morphim pcore mod pcore mod res pcore mod1 pseries rcons pseries subfun pseries sub morphim pseries pseries pseries ig fun pseries fun pseries pg fun pseries char pseries normal pseries pseries1 pseries pop pseries pop2 pseries sub catl quotient pseries pseries norm2 pseries sub catr quotient pseries2 quotient pseries cat pseries catl id pseries char catl pseries catr id pseries char catr pcore modp pquotient pcore trivg pcore quotient pseries rcons id eq pcore sub in pcore sub pcore eq in pcore eq pcore pcore nk eq p'core sdprod hall p'core sdprod p'core hall pcore bigcap p'core coprime pcore ti pcore pcore set normal injm injm pgroup injm pelt injm hall injm pcore injm pseries isog isog pgroup isog pcore isog pseries,v_file
