module_id,cluster,raw_declarations,declaration_count,token_bag,source
rat,algebra,rat ratz rat_isSub numq denq denq_gt0 denq_ge0 denq_lt0 denq_neq0 denq_eq0 coprime_num_den RatK fracq_subdef fracq_opt_subdef fracq_opt_subdefE fracq_subproof fracq_opt_subdef_id fracq Irat_prf Irat parse print val_fracq num_fracq den_fracq ratz_frac valqK scalq scalq_def scalq_eq0 sgr_scalq signr_scalq scalqE valq_frac zeroq oneq frac0q fracq0 fracq_spec fracqP rat_eqE sgr_denq normr_denq absz_denq rat_eq fracq_eq fracq_eq0 fracqMM addq_subdef addq addq_def addq_subdefE oppq_subdef oppq oppq_def addq_subdefC addq_subdefA addq_frac ratzD oppq_frac ratzN addqC addqA add0q addNq mulq_subdef mulq mulq_def mulq_subdefE mulq_subdefC mul_subdefA invq_subdef invq invq_def mulq_frac ratzM invq_frac mulqC mulqA mul1q mulq_addl nonzero1q mulVq invq0 numq_eq0 subq divq ratzE numq_int denq_int rat0 rat1 numqN denqN intq_eq0 fracqE divq_num_den divq_spec divqP rat_spec ratP coprimeq_num coprimeq_den denqVz numqE denqP normq le_rat lt_rat normqE le_ratE lt_ratE gt_rat0 lt_rat0 ge_rat0 le_rat0 le_rat0D le_rat0M le_rat0_anti sgr_numq_div subq_ge0 le_rat_total numq_sign_mul numq_div_lt0 normr_num_div norm_ratN ge_rat0_norm lt_rat_def numq_ge0 numq_le0 numq_gt0 numq_lt0 sgr_numq denq_mulr_sign denq_norm ratArchimedean ratArchimedean floor ceil truncn is_int is_nat floorP ceilP truncnP intrP natrP floorErat ceilErat Qint_def numqK natq_div InRing ratr ratr_int ratr_nat rpred_rat Fmorph fmorph_rat fmorph_eq_rat Linear rat_linear InPrealField ratr_is_zmod_morphism ratr_is_additive ratr_is_monoid_morphism ratr_is_multiplicative ler_rat ltr_rat ler0q lerq0 ltr0q ltrq0 ratr_sg ratr_norm minr_rat maxr_rat InParchiField floor_rat ceil_rat Qint_dvdz Qnat_dvd ZpolyScale size_rat_int_poly rat_poly_scale dvdp_rat_int dvdpP_rat_int irreducible_rat_int inIntSpan solve_Qint_span dec_Qint_span eisenstein_crit rat_vm_compute,193,rat ratz rat is sub numq denq denq gt0 denq ge0 denq lt0 denq neq0 denq eq0 coprime num den rat fracq subdef fracq opt subdef fracq opt subdef fracq subproof fracq opt subdef id fracq irat prf irat parse print val fracq num fracq den fracq ratz frac valq scalq scalq def scalq eq0 sgr scalq signr scalq scalq valq frac zeroq oneq frac0q fracq0 fracq spec fracq rat eq sgr denq normr denq absz denq rat eq fracq eq fracq eq0 fracq mm addq subdef addq addq def addq subdef oppq subdef oppq oppq def addq subdef addq subdef addq frac ratz oppq frac ratz addq addq add0q add nq mulq subdef mulq mulq def mulq subdef mulq subdef mul subdef invq subdef invq invq def mulq frac ratz invq frac mulq mulq mul1q mulq addl nonzero1q mul vq invq0 numq eq0 subq divq ratz numq int denq int rat0 rat1 numq denq intq eq0 fracq divq num den divq spec divq rat spec rat coprimeq num coprimeq den denq vz numq denq normq le rat lt rat normq le rat lt rat gt rat0 lt rat0 ge rat0 le rat0 le rat0d le rat0m le rat0 anti sgr numq div subq ge0 le rat total numq sign mul numq div lt0 normr num div norm rat ge rat0 norm lt rat def numq ge0 numq le0 numq gt0 numq lt0 sgr numq denq mulr sign denq norm rat archimedean rat archimedean floor ceil truncn is int is nat floor ceil truncn intr natr floor erat ceil erat qint def numq natq div in ring ratr ratr int ratr nat rpred rat fmorph fmorph rat fmorph eq rat linear rat linear in preal field ratr is zmod morphism ratr is additive ratr is monoid morphism ratr is multiplicative ler rat ltr rat ler0q lerq0 ltr0q ltrq0 ratr sg ratr norm minr rat maxr rat in parchi field floor rat ceil rat qint dvdz qnat dvd zpoly scale size rat int poly rat poly scale dvdp rat int dvdp rat int irreducible rat int in int span solve qint span dec qint span eisenstein crit rat vm compute,v_file
polydiv,algebra,Pdiv CommonRing RingPseudoDivision redivp_rec redivp_expanded_def redivp_key redivp redivp_unlockable rdivp rmodp rscalp rdvdp redivp_def rdiv0p rdivp0 rdivp_small leq_rdivp rmod0p rmodp0 rscalp_small ltn_rmodp ltn_rmodpN0 rmodp1 rmodp_small leq_rmodp rmodpC rdvdp0 rdvd0p rdvd0pP rdvdpN0 rdvdp1 rdvd1p Nrdvdp_small rmodp_eq0P rmodp_eq0 rdvdp_leq rgcdp rgcd0p rgcdp0 rgcdpE comm_redivp_spec comm_redivpP rmodpp rcoprimep rgdcop_rec rgdcop rgdcop0 RingComRreg ComRegDivisor redivp_eq rdivp_eq eq_rdvdp rdvdp_spec rdvdp_eqP rdvdp_mull rmodp_mull rmodpp rdivpp rdvdpp rdivpK RingMonic RingMonic MonicDivisor redivp_eq rdivp_eq rdivpp rdivp_addl_mul_small rdivp_addl_mul rdivpDl rdivpDr rdivp_mull rmodp_mull rmodpp rmodp_addl_mul_small rmodp_id rmodpD rmodpN rmodpB rmodpZ rmodp_sum rmodp_mulmr rdvdpp eq_rdvdp rdvdp_mull rdvdpP rdivpK drop_poly_rdivp take_poly_rmodp ComRingMonic rmodp_mulml rmodpX rmodp_compr Ring ExtraMonicDivisor rdivp1 rdvdp_XsubCl polyXsubCP root_factor_theorem ComRing CommutativeRingPseudoDivision redivp_spec redivpP rdivp_eq rdvdp_eqP rdvdp_eq UnitRing UnitRingPseudoDivision uniq_roots_rdvdp IdomainDefs IDomainPseudoDivisionDefs edivp_expanded_def edivp_key edivp edivp_unlockable divp modp scalp dvdp eqp WeakIdomain WeakTheoryForIDomainPseudoDivision edivp_def edivp_redivp divpE modpE scalpE dvdpE lc_expn_scalp_neq0 edivp_spec edivpP edivp_eq divp_eq dvdp_eq divpK divpKC dvdpP mulpK mulKp divpp CommonIdomain IDomainPseudoDivision scalp0 divp_small leq_divp div0p divp0 divp1 modp0 mod0p modp1 modp_small modpC modp_mull modp_mulr modpp ltn_modp ltn_divpl leq_divpr divpN0 size_divp ltn_modpN0 modp_id leq_modp dvdp0 dvd0p dvd0pP dvdpN0 dvdp1 dvd1p gtNdvdp modp_eq0P modp_eq0 leq_divpl dvdp_leq eq_dvdp dvdpp divp_dvd dvdp_mull dvdp_mulr dvdp_mul dvdp_addr dvdp_addl dvdp_add dvdp_add_eq dvdp_subr dvdp_subl dvdp_sub dvdp_mod dvdp_trans dvdp_mulIl dvdp_mulIr dvdp_mul2r dvdp_mul2l ltn_divpr dvdp_exp dvdp_exp2l dvdp_Pexp2l dvdp_exp2r dvdp_exp_sub dvdp_XsubCl root_dvdp polyXsubCP eqp_div_XsubC root_factor_theorem uniq_roots_dvdp root_bigmul eqpP eqp_eq eqpxx eqpW eqp_sym eqp_trans eqp_ltrans eqp_rtrans eqp0 eqp01 eqp_scale eqp_size size_poly_eq1 polyXsubC_eqp1 dvdp_eqp1 eqp_dvdr eqp_dvdl dvdpZr dvdpZl dvdpNl dvdpNr eqp_mul2r eqp_mul2l eqp_mull eqp_mulr eqp_exp polyC_eqp1 dvdUp dvdp_size_eqp eqp_root eqp_rmod_mod eqp_rdiv_div dvd_eqp_divl gcdp gcd0p gcdp0 gcdpE size_gcd1p size_gcdp1 gcdpp dvdp_gcdlr dvdp_gcdl dvdp_gcdr leq_gcdpl leq_gcdpr dvdp_gcd gcdpC gcd1p gcdp1 gcdp_addl_mul gcdp_addl gcdp_addr gcdp_mull gcdp_mulr gcdp_scalel gcdp_scaler dvdp_gcd_idl dvdp_gcd_idr gcdp_exp gcdp_eq0 eqp_gcdr eqp_gcdl eqp_gcd eqp_rgcd_gcd gcdp_modl gcdp_modr gcdp_def coprimep coprimep_size_gcd coprimep_def coprimepZl coprimepZr coprimepp gcdp_eqp1 coprimep_sym coprime1p coprimep1 coprimep0 coprime0p coprimepP coprimepPn coprimep_dvdl coprimep_dvdr coprimep_modl coprimep_modr rcoprimep_coprimep eqp_coprimepr eqp_coprimepl egcdp_rec egcdp egcdp0 egcdp_recP egcdpP egcdpE Bezoutp Bezout_coprimepP coprimep_root Gauss_dvdpl Gauss_dvdpr Gauss_dvdp Gauss_gcdpr Gauss_gcdpl coprimepMr coprimepMl modp_coprime coprimep_pexpl coprimep_pexpr coprimep_expl coprimep_expr gcdp_mul2l gcdp_mul2r mulp_gcdr mulp_gcdl coprimep_div_gcd divp_eq0 dvdp_div_eq0 Bezout_coprimepPn dvdp_pexp2r root_gcd root_biggcd gdcop_rec gdcop gdcop_spec gdcop0 gdcop_recP gdcopP coprimep_gdco size2_dvdp_gdco dvdp_gdco root_gdco dvdp_comp_poly gcdp_comp_poly coprimep_comp_poly coprimep_addl_mul irreducible_poly irredp_neq0 apply_irredp apply_irredp modp_XsubC coprimep_XsubC coprimep_XsubC2 coprimepX eqp_monic dvdp_mul_XsubC dvdp_prod_XsubC irredp_XsubC irredp_XaddC irredp_XsubCP dvdp_exp_XsubCP Idomain IdomainMonic IdomainMonic MonicDivisor divpE modpE scalpE divp_eq divpp dvdp_eq dvdpP mulpK mulKp drop_poly_divp take_poly_modp IdomainUnit UnitDivisor divp_eq edivpP divpP modpP ulc_eqpP dvdp_eq ucl_eqp_eq modpZl divpZl eqp_modpl eqp_divl modpN divpN modpD divpD mulpK mulKp divp_addl_mul_small modp_addl_mul_small divp_addl_mul divpp leq_divMp dvdpP divpK divpKC dvdp_eq_div dvdp_eq_mul divp_mulA divp_mulAC divp_mulCA modp_mul leq_trunc_divp MoreUnitDivisor expp_sub divp_pmul2l divp_pmul2r divp_divl divpAC modpZr divpZr Field FieldDivision divp_eq divp_modpP divpP modpP eqpfP dvdp_eq eqpf_eq modpZl mulpK mulKp divpZl modpZr divpZr eqp_modpl eqp_divl eqp_modpr eqp_mod eqp_divr eqp_div eqp_gdcor eqp_gdcol eqp_rgdco_gdco modpD modpN modNp divpD divpN divp_addl_mul_small modp_addl_mul_small divp_addl_mul divpp leq_divMp divpK divpKC dvdp_eq_div dvdp_eq_mul divp_mulA divp_mulAC divp_mulCA expp_sub divp_pmul2l divp_pmul2r divp_divl divpAC edivp_def divpE modpE scalpE dvdpE edivp_spec edivpP edivp_eq modp_mul horner_mod dvdpP Bezout_eq1_coprimepP dvdp_gdcor reducible_cubic_root cubic_irreducible Multiplicity mup mup_geq mup_leq mup_ltn XsubC_dvd mup_XsubCX mupNroot mupMr mupMl mupM mu_prod_XsubC prod_XsubC_eq FieldRingMap redivp_map FieldMap edivp_map scalp_map map_divp map_modp egcdp_map dvdp_map eqp_map gcdp_map coprimep_map gdcop_rec_map gdcop_map leq_trunc_divp ClosedField closed root_coprimep coprimepP,505,pdiv common ring ring pseudo division redivp rec redivp expanded def redivp key redivp redivp unlockable rdivp rmodp rscalp rdvdp redivp def rdiv0p rdivp0 rdivp small leq rdivp rmod0p rmodp0 rscalp small ltn rmodp ltn rmodp n0 rmodp1 rmodp small leq rmodp rmodp rdvdp0 rdvd0p rdvd0p rdvdp n0 rdvdp1 rdvd1p nrdvdp small rmodp eq0p rmodp eq0 rdvdp leq rgcdp rgcd0p rgcdp0 rgcdp comm redivp spec comm redivp rmodpp rcoprimep rgdcop rec rgdcop rgdcop0 ring com rreg com reg divisor redivp eq rdivp eq eq rdvdp rdvdp spec rdvdp eq rdvdp mull rmodp mull rmodpp rdivpp rdvdpp rdivp ring monic ring monic monic divisor redivp eq rdivp eq rdivpp rdivp addl mul small rdivp addl mul rdivp dl rdivp dr rdivp mull rmodp mull rmodpp rmodp addl mul small rmodp id rmodp rmodp rmodp rmodp rmodp sum rmodp mulmr rdvdpp eq rdvdp rdvdp mull rdvdp rdivp drop poly rdivp take poly rmodp com ring monic rmodp mulml rmodp rmodp compr ring extra monic divisor rdivp1 rdvdp xsub cl poly xsub cp root factor theorem com ring commutative ring pseudo division redivp spec redivp rdivp eq rdvdp eq rdvdp eq unit ring unit ring pseudo division uniq roots rdvdp idomain defs domain pseudo division defs edivp expanded def edivp key edivp edivp unlockable divp modp scalp dvdp eqp weak idomain weak theory for domain pseudo division edivp def edivp redivp divp modp scalp dvdp lc expn scalp neq0 edivp spec edivp edivp eq divp eq dvdp eq divp divp kc dvdp mulp mul kp divpp common idomain domain pseudo division scalp0 divp small leq divp div0p divp0 divp1 modp0 mod0p modp1 modp small modp modp mull modp mulr modpp ltn modp ltn divpl leq divpr divp n0 size divp ltn modp n0 modp id leq modp dvdp0 dvd0p dvd0p dvdp n0 dvdp1 dvd1p gt ndvdp modp eq0p modp eq0 leq divpl dvdp leq eq dvdp dvdpp divp dvd dvdp mull dvdp mulr dvdp mul dvdp addr dvdp addl dvdp add dvdp add eq dvdp subr dvdp subl dvdp sub dvdp mod dvdp trans dvdp mul il dvdp mul ir dvdp mul2r dvdp mul2l ltn divpr dvdp exp dvdp exp2l dvdp pexp2l dvdp exp2r dvdp exp sub dvdp xsub cl root dvdp poly xsub cp eqp div xsub root factor theorem uniq roots dvdp root bigmul eqp eqp eq eqpxx eqp eqp sym eqp trans eqp ltrans eqp rtrans eqp0 eqp01 eqp scale eqp size size poly eq1 poly xsub eqp1 dvdp eqp1 eqp dvdr eqp dvdl dvdp zr dvdp zl dvdp nl dvdp nr eqp mul2r eqp mul2l eqp mull eqp mulr eqp exp poly eqp1 dvd up dvdp size eqp eqp root eqp rmod mod eqp rdiv div dvd eqp divl gcdp gcd0p gcdp0 gcdp size gcd1p size gcdp1 gcdpp dvdp gcdlr dvdp gcdl dvdp gcdr leq gcdpl leq gcdpr dvdp gcd gcdp gcd1p gcdp1 gcdp addl mul gcdp addl gcdp addr gcdp mull gcdp mulr gcdp scalel gcdp scaler dvdp gcd idl dvdp gcd idr gcdp exp gcdp eq0 eqp gcdr eqp gcdl eqp gcd eqp rgcd gcd gcdp modl gcdp modr gcdp def coprimep coprimep size gcd coprimep def coprimep zl coprimep zr coprimepp gcdp eqp1 coprimep sym coprime1p coprimep1 coprimep0 coprime0p coprimep coprimep pn coprimep dvdl coprimep dvdr coprimep modl coprimep modr rcoprimep coprimep eqp coprimepr eqp coprimepl egcdp rec egcdp egcdp0 egcdp rec egcdp egcdp bezoutp bezout coprimep coprimep root gauss dvdpl gauss dvdpr gauss dvdp gauss gcdpr gauss gcdpl coprimep mr coprimep ml modp coprime coprimep pexpl coprimep pexpr coprimep expl coprimep expr gcdp mul2l gcdp mul2r mulp gcdr mulp gcdl coprimep div gcd divp eq0 dvdp div eq0 bezout coprimep pn dvdp pexp2r root gcd root biggcd gdcop rec gdcop gdcop spec gdcop0 gdcop rec gdcop coprimep gdco size2 dvdp gdco dvdp gdco root gdco dvdp comp poly gcdp comp poly coprimep comp poly coprimep addl mul irreducible poly irredp neq0 apply irredp apply irredp modp xsub coprimep xsub coprimep xsub c2 coprimep eqp monic dvdp mul xsub dvdp prod xsub irredp xsub irredp xadd irredp xsub cp dvdp exp xsub cp idomain idomain monic idomain monic monic divisor divp modp scalp divp eq divpp dvdp eq dvdp mulp mul kp drop poly divp take poly modp idomain unit unit divisor divp eq edivp divp modp ulc eqp dvdp eq ucl eqp eq modp zl divp zl eqp modpl eqp divl modp divp modp divp mulp mul kp divp addl mul small modp addl mul small divp addl mul divpp leq div mp dvdp divp divp kc dvdp eq div dvdp eq mul divp mul divp mul ac divp mul ca modp mul leq trunc divp more unit divisor expp sub divp pmul2l divp pmul2r divp divl divp ac modp zr divp zr field field division divp eq divp modp divp modp eqpf dvdp eq eqpf eq modp zl mulp mul kp divp zl modp zr divp zr eqp modpl eqp divl eqp modpr eqp mod eqp divr eqp div eqp gdcor eqp gdcol eqp rgdco gdco modp modp mod np divp divp divp addl mul small modp addl mul small divp addl mul divpp leq div mp divp divp kc dvdp eq div dvdp eq mul divp mul divp mul ac divp mul ca expp sub divp pmul2l divp pmul2r divp divl divp ac edivp def divp modp scalp dvdp edivp spec edivp edivp eq modp mul horner mod dvdp bezout eq1 coprimep dvdp gdcor reducible cubic root cubic irreducible multiplicity mup mup geq mup leq mup ltn xsub dvd mup xsub cx mup nroot mup mr mup ml mup mu prod xsub prod xsub eq field ring map redivp map field map edivp map scalp map map divp map modp egcdp map dvdp map eqp map gcdp map coprimep map gdcop rec map gdcop map leq trunc divp closed field closed root coprimep coprimep,v_file
interval,algebra,itv_bound BLeft BRight interval pair_of_interval itv_bound_display interval_display IntervalCan IntervalCan itv_bound_can interval_can Exports IntervalPOrder le_bound lt_bound lt_bound_def le_bound_refl le_bound_anti le_bound_trans bound_lexx bound_ltxx ge_pinfty le_ninfty gt_pinfty lt_ninfty ltBSide leBSide lteBSide ltBRight_leBLeft leBRight_ltBLeft BLeft_ltE BRight_leE BRight_BLeft_leE BLeft_BRight_ltE BRight_BSide_ltE BLeft_BSide_leE BSide_ltE BSide_leE BInfty_leE BInfty_geE BInfty_le_eqE BInfty_ge_eqE BInfty_ltE BInfty_gtE BInfty_ltF BInfty_gtF BInfty_BInfty_ltE bnd_simp comparable_BSide_min comparable_BSide_max subitv subitv_refl subitv_anti subitv_trans pred_of_itv Structure subitvE in_itv itv_boundlr itv_splitI subitvP subset_itv subset_itv_bound subset_itv_oo_cc subset_itv_oo_oc subset_itv_oo_co subset_itv_oc_cc subset_itv_co_cc itvxx itvxxP subitvPl subitvPr itv_xx boundl_in_itv boundr_in_itv bound_in_itv lt_in_itv lteif_in_itv itv_ge itv_decompose itv_dec itv_rewrite itvP itv_splitU1 itv_split1U IntervalLattice bound_meet bound_join bound_meetC bound_joinC bound_meetA bound_joinA bound_meetKU bound_joinKI bound_leEmeet bound_le0x bound_lex1 itv_meet itv_join itv_meetC itv_joinC itv_meetA itv_joinA itv_meetKU itv_joinKI itv_leEmeet itv_le0x itv_lex1 in_itvI IntervalTotal BSide_min BSide_max itv_bound_total itv_meetUl itv_splitU itv_splitUeq itv_total_meet3E itv_total_join3E predC_itvl predC_itvr predC_itv,121,itv bound left right interval pair of interval itv bound display interval display interval can interval can itv bound can interval can exports interval order le bound lt bound lt bound def le bound refl le bound anti le bound trans bound lexx bound ltxx ge pinfty le ninfty gt pinfty lt ninfty lt side le side lte side lt right le left le right lt left left lt right le right left le left right lt right side lt left side le side lt side le infty le infty ge infty le eq infty ge eq infty lt infty gt infty lt infty gt infty infty lt bnd simp comparable side min comparable side max subitv subitv refl subitv anti subitv trans pred of itv structure subitv in itv itv boundlr itv split subitv subset itv subset itv bound subset itv oo cc subset itv oo oc subset itv oo co subset itv oc cc subset itv co cc itvxx itvxx subitv pl subitv pr itv xx boundl in itv boundr in itv bound in itv lt in itv lteif in itv itv ge itv decompose itv dec itv rewrite itv itv split u1 itv split1u interval lattice bound meet bound join bound meet bound join bound meet bound join bound meet ku bound join ki bound le emeet bound le0x bound lex1 itv meet itv join itv meet itv join itv meet itv join itv meet ku itv join ki itv le emeet itv le0x itv lex1 in itv interval total side min side max itv bound total itv meet ul itv split itv split ueq itv total meet3e itv total join3e pred itvl pred itvr pred itv,v_file
qpoly,algebra,NPoly poly_of_size_pred poly_of_size npoly_subsemimod_closed npoly npoly_is_a_poly_of_size size_npoly npoly_rV rVnpoly npoly_rV_K rVnpolyK npoly_vect_axiom SemiNPolyTheory polyn_is_semilinear mk_npoly size_npoly0 npoly0 npolyp_key npolyp npoly_of_seq npolyP coef_npolyp big_coef_npoly npolypK coefn_sum NPolyTheory npoly_oppr_closed FinSemiNPolyTheory npoly_enum npoly_enum_uniq mem_npoly_enum card_npoly Irreducible irreducibleb irreducibleP Vspace dim_polyn npolyX npolyXE nth_npolyX npolyX_free npolyX_full npolyX_coords npolyX_gen lagrange lagrange_def lagrange_key lagrange lagrange_ lagrange_def_sample size_lagrange_def lagrangeE nth_lagrange size_lagrange_ size_lagrange lagrange_sample lagrange_free lagrange_full lagrange_coords lagrange_gen Qpoly mk_monic qpoly QpolyProp monic_mk_monic size_mk_monic_gt1 size_mk_monic_gt0 mk_monic_neq0 size_mk_monic poly_of_size_mod in_qpoly in_qpoly_small in_qpoly0 in_qpolyD in_qpolyZ in_qpoly_is_linear qpolyC_proof qpolyC qpolyCE qpolyC0 qpoly1 qpoly_mul qpoly_mul1z qpoly_mulz1 qpoly_nontrivial qpolyX qpolyXE mk_monic_X mk_monic_Xn card_qpoly card_monic_qpoly QRing qpoly_mulC qpoly_mulA qpoly_mul_addr qpoly_mul_addl in_qpoly1 in_qpolyM in_qpoly_monoid_morphism in_qpoly_is_multiplicative poly_of_qpoly_sum poly_of_qpolyD qpolyC_natr pchar_qpoly poly_of_qpolyM poly_of_qpolyX qpolyCN qpolyCD qpolyCM qpolyC_is_zmod_morphism qpolyC_is_additive qpolyC_is_monoid_morphism qpolyC_is_multiplicative qpoly_scale qpoly_scaleA qpoly_scale1l qpoly_scaleDr qpoly_scaleDl qpoly_scaleAl qpoly_scaleAr poly_of_qpolyZ char_qpoly Field qpoly_inv qpoly_mulVz qpoly_mulzV qpoly_intro_unit qpoly_inv_out irreducible_poly_coprime,129,poly poly of size pred poly of size npoly subsemimod closed npoly npoly is poly of size size npoly npoly rv vnpoly npoly rv vnpoly npoly vect axiom semi poly theory polyn is semilinear mk npoly size npoly0 npoly0 npolyp key npolyp npoly of seq npoly coef npolyp big coef npoly npolyp coefn sum poly theory npoly oppr closed fin semi poly theory npoly enum npoly enum uniq mem npoly enum card npoly irreducible irreducibleb irreducible vspace dim polyn npoly npoly xe nth npoly npoly free npoly full npoly coords npoly gen lagrange lagrange def lagrange key lagrange lagrange lagrange def sample size lagrange def lagrange nth lagrange size lagrange size lagrange lagrange sample lagrange free lagrange full lagrange coords lagrange gen qpoly mk monic qpoly qpoly prop monic mk monic size mk monic gt1 size mk monic gt0 mk monic neq0 size mk monic poly of size mod in qpoly in qpoly small in qpoly0 in qpoly in qpoly in qpoly is linear qpoly proof qpoly qpoly ce qpoly c0 qpoly1 qpoly mul qpoly mul1z qpoly mulz1 qpoly nontrivial qpoly qpoly xe mk monic mk monic xn card qpoly card monic qpoly ring qpoly mul qpoly mul qpoly mul addr qpoly mul addl in qpoly1 in qpoly in qpoly monoid morphism in qpoly is multiplicative poly of qpoly sum poly of qpoly qpoly natr pchar qpoly poly of qpoly poly of qpoly qpoly cn qpoly cd qpoly cm qpoly is zmod morphism qpoly is additive qpoly is monoid morphism qpoly is multiplicative qpoly scale qpoly scale qpoly scale1l qpoly scale dr qpoly scale dl qpoly scale al qpoly scale ar poly of qpoly char qpoly field qpoly inv qpoly mul vz qpoly mulz qpoly intro unit qpoly inv out irreducible poly coprime,v_file
archimedean,algebra,Num Record Definition ArchiNumDomainExports Definition ArchiNumFieldExports Definition ArchiClosedFieldExports Definition ArchiRealDomainExports Definition ArchiRealFieldExports Definition ArchiRealClosedFieldExports Def nat_num int_num bound trunc Def truncn trunc floor ceil nat_num int_num archi_bound intArchimedean intArchimedean floor_subproof intrP natrP Import ArchiNumDomainTheory floorNceil ceilNfloor truncEfloor natrP intrP intr_int natr_nat rpred_int_num rpred_nat_num int_num0 int_num1 nat_num0 nat_num1 int_num_subring nat_num_semiring Rreal_nat intr_nat Rreal_int intrE natr_int intr_normK natr_normK natr_norm_int natr_ge0 natr_gt0 natrEint intrEge0 intrEsign norm_natr natr_exp_even norm_intr_ge1 sqr_intr_ge1 intr_ler_sqr real_floor_itv real_floor_le real_floorD1_gt floor_def real_floor_ge_int real_floor_lt_int real_floor_eq le_floor intrKfloor intrEfloor floorK floor0 floor1 real_floorDzr real_floorDrz floorN floorM floorX real_floor_ge0 floor_lt0 real_floor_le0 floor_gt0 floor_neq0 floorpK floorpP real_ceil_itv real_ceilB1_lt real_ceil_ge ceil_def real_ceil_le_int real_ceil_gt_int real_ceil_eq le_ceil intrKceil intrEceil ceilK ceil0 ceil1 real_ceilDzr real_ceilDrz ceilN ceilM ceilX real_ceil_ge0 ceil_lt0 real_ceil_le0 ceil_gt0 ceil_neq0 real_ceil_floor truncn_floor truncn_itv truncn_le real_truncnS_gt truncn_def truncn_ge_nat truncn_gt_nat truncn_lt_nat real_truncn_le_nat truncn_eq le_truncn natrK natrEtruncn archi_boundP truncnK truncn0 truncn1 truncnD truncnM truncnX truncn_gt0 truncn0Pn sum_truncnK prod_truncnK natr_sum_eq1 natr_mul_eq1 natr_prod_eq1 raddfZ_nat rpredZ_nat raddfZ_int rpredZ_int aut_natr aut_intr trunc_itv trunc_def truncK trunc0 trunc1 truncD truncM truncX trunc_gt0 trunc0Pn sum_truncK prod_truncK trunc_floor real_ge_floor real_lt_succ_floor real_gt_pred_ceil real_le_ceil ceil_le natrE le_ceil_tmp real_floor_ge_int_tmp real_ceil_le_int_tmp ArchiRealDomainTheory upper_nthrootP truncnS_gt truncn_le_nat floor_itv floor_le floorD1_gt floor_ge_int floor_lt_int floor_eq floorDzr floorDrz floor_ge0 floor_le0 ceil_itv ceilB1_lt ceil_ge ceil_le_int ceil_gt_int ceil_eq ceilDzr ceilDrz ceil_ge0 ceil_le0 ceil_floor ge_floor lt_succ_floor gt_pred_ceil floor_le_tmp floor_ge_int_tmp ceil_le_int_tmp ArchiNumFieldTheory natr_aut intr_aut ArchiClosedFieldTheory conj_natr conj_intr ZnatPred Znat_def ZnatP Record NumDomain_isArchimedean NumDomain_isArchimedean Build Context truncn_itv floor floor_subproof truncnE truncn_def natrK intrP natrP Record Context bound boundP truncn_sig truncn truncn_subproof Exports nat int ArchiDomain ArchiDomain type copy on ArchiField ArchiField type copy on floorD ceilD real_ceilD archiDomainType archiFieldType,249,num record definition archi num domain exports definition archi num field exports definition archi closed field exports definition archi real domain exports definition archi real field exports definition archi real closed field exports def nat num int num bound trunc def truncn trunc floor ceil nat num int num archi bound int archimedean int archimedean floor subproof intr natr import archi num domain theory floor nceil ceil nfloor trunc efloor natr intr intr int natr nat rpred int num rpred nat num int num0 int num1 nat num0 nat num1 int num subring nat num semiring rreal nat intr nat rreal int intr natr int intr norm natr norm natr norm int natr ge0 natr gt0 natr eint intr ege0 intr esign norm natr natr exp even norm intr ge1 sqr intr ge1 intr ler sqr real floor itv real floor le real floor d1 gt floor def real floor ge int real floor lt int real floor eq le floor intr kfloor intr efloor floor floor0 floor1 real floor dzr real floor drz floor floor floor real floor ge0 floor lt0 real floor le0 floor gt0 floor neq0 floorp floorp real ceil itv real ceil b1 lt real ceil ge ceil def real ceil le int real ceil gt int real ceil eq le ceil intr kceil intr eceil ceil ceil0 ceil1 real ceil dzr real ceil drz ceil ceil ceil real ceil ge0 ceil lt0 real ceil le0 ceil gt0 ceil neq0 real ceil floor truncn floor truncn itv truncn le real truncn gt truncn def truncn ge nat truncn gt nat truncn lt nat real truncn le nat truncn eq le truncn natr natr etruncn archi bound truncn truncn0 truncn1 truncn truncn truncn truncn gt0 truncn0pn sum truncn prod truncn natr sum eq1 natr mul eq1 natr prod eq1 raddf nat rpred nat raddf int rpred int aut natr aut intr trunc itv trunc def trunc trunc0 trunc1 trunc trunc trunc trunc gt0 trunc0pn sum trunc prod trunc trunc floor real ge floor real lt succ floor real gt pred ceil real le ceil ceil le natr le ceil tmp real floor ge int tmp real ceil le int tmp archi real domain theory upper nthroot truncn gt truncn le nat floor itv floor le floor d1 gt floor ge int floor lt int floor eq floor dzr floor drz floor ge0 floor le0 ceil itv ceil b1 lt ceil ge ceil le int ceil gt int ceil eq ceil dzr ceil drz ceil ge0 ceil le0 ceil floor ge floor lt succ floor gt pred ceil floor le tmp floor ge int tmp ceil le int tmp archi num field theory natr aut intr aut archi closed field theory conj natr conj intr znat pred znat def znat record num domain is archimedean num domain is archimedean build context truncn itv floor floor subproof truncn truncn def natr intr natr record context bound bound truncn sig truncn truncn subproof exports nat int archi domain archi domain type copy on archi field archi field type copy on floor ceil real ceil archi domain type archi field type,v_file
