module_id,cluster,raw_declarations,declaration_count,token_bag,source
ssrnat,boot,succn predn succnK succn_inj eqn eqnP eqnE eqSS nat_irrelevance addn addn_rec addnE plusE add0n addSn add1n addn0 addnS addSnnS addnCA addnC addn1 addnA addnAC addnCAC addnACl addnACA addn_eq0 addn_eq1 eqn_add2l eqn_add2r addnI addIn addn2 add2n addn3 add3n addn4 add4n subn subn_rec subnE minusE sub0n subn0 subnn subSS subn1 subn2 subnDl subnDr addnK addKn subSnn subnDA subnAC subnS subSKn leq geq ltn gtn ltnS leq0n ltn0Sn ltn0 leqnn ltnSn eq_leq leqnSn leq_pred leqSpred ltn_predL ltn_predRL ltn_predK prednK leqNgt leqVgt ltnNge ltnn leqn0 lt0n lt0n_neq0 eqn0Ngt neq0_lt0n eqn_leq anti_leq neq_ltn gtn_eqF ltn_eqF ltn_geF leq_gtF leq_eqVlt ltn_neqAle leq_trans leq_ltn_trans ltnW leqW ltn_trans leq_total leq_leP ltn_gtP leq_geP leq_ltP leq_gtP ltn_ltP eqn_geP eqn_leP eqn_gtP eqn_ltP ubnP ltnSE ubn_leq_spec ubn_geq_spec ubn_eq_spec ubnPleq ubnPgeq ubnPeq ltn_ind leP le_irrelevance ltP lt_irrelevance leq_add2l ltn_add2l leq_add2r ltn_add2r leq_add leq_addl leq_addr ltn_addl ltn_addr addn_gt0 subn_gt0 subn_eq0 leq_subLR leq_subr ltn_subrR leq_subrR ltn_subrL subnKC addnBn subnK addnBA addnBAC addnBCA addnABC subnBA subnA subKn subSn subnSK addnCBA addnBr_leq addnBl_leq subnDAC subnCBA subnBr_leq subnBl_leq subnBAC subDnAC subDnCA subDnCAC addnBC addnCB addBnAC addBnCAC addBnA subBnAC predn_sub leq_sub2r leq_sub2l leq_sub ltn_sub2r ltn_sub2l ltn_subRL leq_psubRL ltn_psubLR leq_subRL ltn_subLR leq_subCl ltn_subCr leq_psubCr ltn_psubCl leq_subCr ltn_subCl leq_sub2rE leq_sub2lE ltn_sub2rE ltn_sub2lE eqn_sub2rE eqn_sub2lE maxn minn max0n maxn0 maxnC maxnE maxnAC maxnA maxnCA maxnACA maxn_idPl maxn_idPr maxnn leq_max leq_maxl leq_maxr gtn_max geq_max maxnSS addn_maxl addn_maxr subn_maxl min0n minn0 minnC addn_min_max minnE minnAC minnA minnCA minnACA minn_idPl minn_idPr minnn leq_min gtn_min geq_min ltn_min geq_minl geq_minr addn_minr addn_minl subn_minl minnSS maxnK maxKn minnK minKn maxn_minl maxn_minr minn_maxl minn_maxr leq_xor_gtn leqP ltn_xor_geq ltnP eqn0_xor_gt0 posnP compare_nat ltngtP subn_if_gt leqLHS leqRHS ltnLHS ltnRHS ExMinn acc_nat find_ex_minn ex_minn ex_minn_spec ex_minnP ExMaxn ex_maxn_subproof ex_maxn ex_maxn_spec ex_maxnP eq_ex_minn eq_ex_maxn Iteration iter iteri iterop iterSr iterS iterD iteriS iteropS eq_iter iter_fix eq_iteri eq_iterop iter_in iter_succn iter_succn_0 iter_predn muln muln_rec multE mulnE mul0n muln0 mul1n mulSn mulSnr mulnS mulnSr iter_addn iter_addn_0 muln1 mulnC mulnDl mulnDr mulnBl mulnBr mulnA mulnCA mulnAC mulnACA muln_eq0 muln_eq1 muln_gt0 leq_pmull leq_pmulr leq_mul2l leq_mul2r leq_mul eqn_mul2l eqn_mul2r leq_pmul2l leq_pmul2r eqn_pmul2l eqn_pmul2r ltn_mul2l ltn_mul2r ltn_pmul2l ltn_pmul2r ltn_Pmull ltn_Pmulr ltn_mull ltn_mulr ltn_mul maxnMr maxnMl minnMr minnMl iterM expn expn_rec expnE expn0 expn1 expnS expnSr iter_muln iter_muln_1 exp0n exp1n expnD expnMn expnM expnAC expn_gt0 expn_eq0 ltn_expl leq_exp2l ltn_exp2l eqn_exp2l expnI leq_pexp2l ltn_pexp2l ltn_exp2r leq_exp2r eqn_exp2r expIn iterX factorial fact_rec factE fact0 factS fact_gt0 fact_geq ltn_fact nat_of_bool leq_b1 addn_negb eqb0 eqb1 lt0b sub1b mulnb mulnbl mulnbr odd oddS oddb oddD oddB oddN oddM oddX double double_rec doubleE double0 doubleS double_pred addnn mul2n muln2 doubleD doubleB leq_double ltn_double ltn_Sdouble leq_Sdouble odd_double double_gt0 double_eq0 doubleMl doubleMr half uphalfE doubleK half_double double_inj uphalf_double uphalf_half odd_double_half halfK uphalfK odd_halfK even_halfK odd_uphalfK even_uphalfK half_bit_double halfD half_leq geq_half_double ltn_half_double leq_half_double gtn_half_double half_gt0 uphalf_leq leq_uphalf_double geq_uphalf_double gtn_uphalf_double ltn_uphalf_double uphalf_gt0 odd_geq odd_ltn odd_gt0 odd_gt2 mulnn sqrnD sqrnB sqrnD_sub subn_sqr ltn_sqr leq_sqr sqrn_gt0 eqn_sqr sqrn_inj leqif leq_of_leqif leqifP leqif_refl leqif_trans mono_leqif leqif_geq leqif_eq geq_leqif ltn_leqif ltnNleqif eq_leqif eqTleqif leqif_add leqif_mul nat_Cauchy nat_AGM2 ContraLeq contraTleq contraTltn contraPleq contraPltn contraNleq contraNltn contra_not_leq contra_not_ltn contraFleq contraFltn contra_leqT contra_ltnT contra_leqN contra_ltnN contra_leq_not contra_ltn_not contra_leqF contra_ltnF contra_leq contra_leq_ltn contra_ltn_leq contra_ltn Monotonicity homo_ltn_in homo_ltn homo_leq_in homo_leq NatToNat ltn_neqAle gtn_neqAge anti_leq anti_geq leq_total ltnW_homo inj_homo_ltn ltnW_nhomo inj_nhomo_ltn incn_inj decn_inj leqW_mono leqW_nmono leq_mono leq_nmono ltnW_homo_in ltnW_nhomo_in inj_homo_ltn_in inj_nhomo_ltn_in incn_inj_in decn_inj_in leqW_mono_in leqW_nmono_in leq_mono_in leq_nmono_in leq_pfact leq_fact ltn_pfact NatTrec add add_mul mul mul_exp exp odd double addE doubleE add_mulE mulE mul_expE expE oddE trecE natTrecE N_eqb eq_binP NumberInterpretation Trec nat_of_pos nat_of_bin pos_of_nat bin_of_nat bin_of_natK nat_of_binK nat_of_succ_pos nat_of_add_pos nat_of_mul_pos number number_subType pop_succn,562,succn predn succn succn inj eqn eqn eqn eq ss nat irrelevance addn addn rec addn plus add0n add sn add1n addn0 addn add snn addn ca addn addn1 addn addn ac addn cac addn cl addn aca addn eq0 addn eq1 eqn add2l eqn add2r addn add in addn2 add2n addn3 add3n addn4 add4n subn subn rec subn minus sub0n subn0 subnn sub ss subn1 subn2 subn dl subn dr addn add kn sub snn subn da subn ac subn sub kn leq geq ltn gtn ltn leq0n ltn0sn ltn0 leqnn ltn sn eq leq leqn sn leq pred leq spred ltn pred ltn pred rl ltn pred predn leq ngt leq vgt ltn nge ltnn leqn0 lt0n lt0n neq0 eqn0ngt neq0 lt0n eqn leq anti leq neq ltn gtn eq ltn eq ltn ge leq gt leq eq vlt ltn neq ale leq trans leq ltn trans ltn leq ltn trans leq total leq le ltn gt leq ge leq lt leq gt ltn lt eqn ge eqn le eqn gt eqn lt ubn ltn se ubn leq spec ubn geq spec ubn eq spec ubn pleq ubn pgeq ubn peq ltn ind le le irrelevance lt lt irrelevance leq add2l ltn add2l leq add2r ltn add2r leq add leq addl leq addr ltn addl ltn addr addn gt0 subn gt0 subn eq0 leq sub lr leq subr ltn subr leq subr ltn subr subn kc addn bn subn addn ba addn bac addn bca addn abc subn ba subn sub kn sub sn subn sk addn cba addn br leq addn bl leq subn dac subn cba subn br leq subn bl leq subn bac sub dn ac sub dn ca sub dn cac addn bc addn cb add bn ac add bn cac add bn sub bn ac predn sub leq sub2r leq sub2l leq sub ltn sub2r ltn sub2l ltn sub rl leq psub rl ltn psub lr leq sub rl ltn sub lr leq sub cl ltn sub cr leq psub cr ltn psub cl leq sub cr ltn sub cl leq sub2r leq sub2l ltn sub2r ltn sub2l eqn sub2r eqn sub2l maxn minn max0n maxn0 maxn maxn maxn ac maxn maxn ca maxn aca maxn id pl maxn id pr maxnn leq max leq maxl leq maxr gtn max geq max maxn ss addn maxl addn maxr subn maxl min0n minn0 minn addn min max minn minn ac minn minn ca minn aca minn id pl minn id pr minnn leq min gtn min geq min ltn min geq minl geq minr addn minr addn minl subn minl minn ss maxn max kn minn min kn maxn minl maxn minr minn maxl minn maxr leq xor gtn leq ltn xor geq ltn eqn0 xor gt0 posn compare nat ltngt subn if gt leq lhs leq rhs ltn lhs ltn rhs ex minn acc nat find ex minn ex minn ex minn spec ex minn ex maxn ex maxn subproof ex maxn ex maxn spec ex maxn eq ex minn eq ex maxn iteration iter iteri iterop iter sr iter iter iteri iterop eq iter iter fix eq iteri eq iterop iter in iter succn iter succn iter predn muln muln rec mult muln mul0n muln0 mul1n mul sn mul snr muln muln sr iter addn iter addn muln1 muln muln dl muln dr muln bl muln br muln muln ca muln ac muln aca muln eq0 muln eq1 muln gt0 leq pmull leq pmulr leq mul2l leq mul2r leq mul eqn mul2l eqn mul2r leq pmul2l leq pmul2r eqn pmul2l eqn pmul2r ltn mul2l ltn mul2r ltn pmul2l ltn pmul2r ltn pmull ltn pmulr ltn mull ltn mulr ltn mul maxn mr maxn ml minn mr minn ml iter expn expn rec expn expn0 expn1 expn expn sr iter muln iter muln exp0n exp1n expn expn mn expn expn ac expn gt0 expn eq0 ltn expl leq exp2l ltn exp2l eqn exp2l expn leq pexp2l ltn pexp2l ltn exp2r leq exp2r eqn exp2r exp in iter factorial fact rec fact fact0 fact fact gt0 fact geq ltn fact nat of bool leq b1 addn negb eqb0 eqb1 lt0b sub1b mulnb mulnbl mulnbr odd odd oddb odd odd odd odd odd double double rec double double0 double double pred addnn mul2n muln2 double double leq double ltn double ltn sdouble leq sdouble odd double double gt0 double eq0 double ml double mr half uphalf double half double double inj uphalf double uphalf half odd double half half uphalf odd half even half odd uphalf even uphalf half bit double half half leq geq half double ltn half double leq half double gtn half double half gt0 uphalf leq leq uphalf double geq uphalf double gtn uphalf double ltn uphalf double uphalf gt0 odd geq odd ltn odd gt0 odd gt2 mulnn sqrn sqrn sqrn sub subn sqr ltn sqr leq sqr sqrn gt0 eqn sqr sqrn inj leqif leq of leqif leqif leqif refl leqif trans mono leqif leqif geq leqif eq geq leqif ltn leqif ltn nleqif eq leqif eq tleqif leqif add leqif mul nat cauchy nat agm2 contra leq contra tleq contra tltn contra pleq contra pltn contra nleq contra nltn contra not leq contra not ltn contra fleq contra fltn contra leq contra ltn contra leq contra ltn contra leq not contra ltn not contra leq contra ltn contra leq contra leq ltn contra ltn leq contra ltn monotonicity homo ltn in homo ltn homo leq in homo leq nat to nat ltn neq ale gtn neq age anti leq anti geq leq total ltn homo inj homo ltn ltn nhomo inj nhomo ltn incn inj decn inj leq mono leq nmono leq mono leq nmono ltn homo in ltn nhomo in inj homo ltn in inj nhomo ltn in incn inj in decn inj in leq mono in leq nmono in leq mono in leq nmono in leq pfact leq fact ltn pfact nat trec add add mul mul mul exp exp odd double add double add mul mul mul exp exp odd trec nat trec eqb eq bin number interpretation trec nat of pos nat of bin pos of nat bin of nat bin of nat nat of bin nat of succ pos nat of add pos nat of mul pos number number sub type pop succn,v_file
path,boot,Paths Path path cat_path rcons_path take_path pathP cycle cycle_path cycle_catC rot_cycle rotr_cycle sorted sortedP path_sorted path_min_sorted pairwise_sorted sorted_cat_cons PathEq rev_path rev_cycle rev_sorted path_relI cycle_relI sorted_relI SubPath_in sub_in_path sub_in_cycle sub_in_sorted EqPath_in e_e' e'_e eq_in_path eq_in_cycle eq_in_sorted SubPath sub_path sub_cycle sub_sorted eq_path eq_cycle eq_sorted Transitive_in order_path_min_in path_sorted_inE sorted_pairwise_in path_pairwise_in cat_sorted2 sorted_mask_in sorted_filter_in path_mask_in path_filter_in sorted_ltn_nth_in sorted_leq_nth_in Transitive order_path_min path_le leT_tr' path_sortedE sorted_pairwise path_pairwise sorted_mask sorted_filter path_mask path_filter sorted_ltn_nth sorted_leq_nth take_sorted drop_sorted HomoPath path_map cycle_map sorted_map homo_path_in homo_cycle_in homo_sorted_in mono_path_in mono_cycle_in mono_sorted_in homo_path homo_cycle homo_sorted mono_path mono_cycle mono_sorted CycleAll2Rel cycle_all2rel cycle_all2rel_in PreInSuffix prefix_path prefix_sorted infix_sorted suffix_sorted EqSorted subseq_path_in subseq_sorted_in sorted_ltn_index_in sorted_leq_index_in subseq_path subseq_sorted sorted_uniq sorted_eq irr_sorted_eq sorted_ltn_index undup_path undup_sorted sorted_leq_index EqSorted_in sorted_uniq_in sorted_eq_in irr_sorted_eq_in EqPath split splitP splitl splitPl splitr splitPr next_at next prev_at prev next_nth prev_nth mem_next mem_prev ucycleb ucycle ucycle_cycle ucycle_uniq next_cycle prev_cycle rot_ucycle rotr_ucycle mem2 mem2l mem2lf mem2r mem2rf mem2_cat mem2_splice mem2_splice1 mem2_cons mem2_seq1 mem2_last mem2l_cat mem2r_cat mem2lr_splice mem2E split2r splitP2r shorten shorten_spec shortenP SortSeq merge merge_sort_push merge_sort_pop merge_sort_rec sort sort_rec1 sortE count_merge size_merge allrel_merge count_sort pairwise_sort size_merge_sort_push Stability leT_lex merge_stable_path merge_stable_sorted leElex merge_path merge_sorted sorted_merge sorted_sort mergeA SortMap Monotonicity map_merge map_sort merge_map sort_map sorted_sort_in EqSortSeq perm_merge mem_merge merge_uniq perm_sort mem_sort sort_uniq eq_count_merge perm_iota_sort all_merge all_sort size_sort ltn_sorted_uniq_leq gtn_sorted_uniq_geq iota_sorted iota_ltn_sorted Stability_iota lt_lex Fixpoint push_stable pop_stable sort_iota_stable sort_pairwise_stable sort_stable sort_stable_in filter_sort filter_sort_in Stability_mask mask_sort sorted_mask_sort Stability_mask_in le_sT le_sT_total le_sT_tr mask_sort_in sorted_mask_sort_in Stability_subseq subseq_sort sorted_subseq_sort mem2_sort Stability_subseq_in subseq_sort_in sorted_subseq_sort_in mem2_sort_in sort_sorted sort_sorted_in perm_sortP perm_sort_inP homo_sort_map homo_sort_map_in fpath fcycle ufcycle Trajectory traject trajectS trajectSr last_traject traject_iteri size_traject nth_traject trajectD take_traject EqTrajectory eq_fpath eq_fcycle fpathE fpathP fpath_traject looping loopingP trajectP looping_uniq Fcycle nextE mem_fcycle inj_cycle UniqCycle prev_next next_prev cycle_next cycle_prev cycle_from_next cycle_from_prev next_rot prev_rot UniqRotrCycle next_rotr prev_rotr UniqCycleRev prev_rev next_rev MapPath rel_base map_path MapEqPath mem2_map next_map prev_map fun_base CycleArc arc arc_rot left_arc right_arc rot_to_arc_spec rot_to_arc,292,paths path path cat path rcons path take path path cycle cycle path cycle cat rot cycle rotr cycle sorted sorted path sorted path min sorted pairwise sorted sorted cat cons path eq rev path rev cycle rev sorted path rel cycle rel sorted rel sub path in sub in path sub in cycle sub in sorted eq path in e' e' eq in path eq in cycle eq in sorted sub path sub path sub cycle sub sorted eq path eq cycle eq sorted transitive in order path min in path sorted in sorted pairwise in path pairwise in cat sorted2 sorted mask in sorted filter in path mask in path filter in sorted ltn nth in sorted leq nth in transitive order path min path le le tr' path sorted sorted pairwise path pairwise sorted mask sorted filter path mask path filter sorted ltn nth sorted leq nth take sorted drop sorted homo path path map cycle map sorted map homo path in homo cycle in homo sorted in mono path in mono cycle in mono sorted in homo path homo cycle homo sorted mono path mono cycle mono sorted cycle all2rel cycle all2rel cycle all2rel in pre in suffix prefix path prefix sorted infix sorted suffix sorted eq sorted subseq path in subseq sorted in sorted ltn index in sorted leq index in subseq path subseq sorted sorted uniq sorted eq irr sorted eq sorted ltn index undup path undup sorted sorted leq index eq sorted in sorted uniq in sorted eq in irr sorted eq in eq path split split splitl split pl splitr split pr next at next prev at prev next nth prev nth mem next mem prev ucycleb ucycle ucycle cycle ucycle uniq next cycle prev cycle rot ucycle rotr ucycle mem2 mem2l mem2lf mem2r mem2rf mem2 cat mem2 splice mem2 splice1 mem2 cons mem2 seq1 mem2 last mem2l cat mem2r cat mem2lr splice mem2e split2r split p2r shorten shorten spec shorten sort seq merge merge sort push merge sort pop merge sort rec sort sort rec1 sort count merge size merge allrel merge count sort pairwise sort size merge sort push stability le lex merge stable path merge stable sorted le elex merge path merge sorted sorted merge sorted sort merge sort map monotonicity map merge map sort merge map sort map sorted sort in eq sort seq perm merge mem merge merge uniq perm sort mem sort sort uniq eq count merge perm iota sort all merge all sort size sort ltn sorted uniq leq gtn sorted uniq geq iota sorted iota ltn sorted stability iota lt lex fixpoint push stable pop stable sort iota stable sort pairwise stable sort stable sort stable in filter sort filter sort in stability mask mask sort sorted mask sort stability mask in le st le st total le st tr mask sort in sorted mask sort in stability subseq subseq sort sorted subseq sort mem2 sort stability subseq in subseq sort in sorted subseq sort in mem2 sort in sort sorted sort sorted in perm sort perm sort in homo sort map homo sort map in fpath fcycle ufcycle trajectory traject traject traject sr last traject traject iteri size traject nth traject traject take traject eq trajectory eq fpath eq fcycle fpath fpath fpath traject looping looping traject looping uniq fcycle next mem fcycle inj cycle uniq cycle prev next next prev cycle next cycle prev cycle from next cycle from prev next rot prev rot uniq rotr cycle next rotr prev rotr uniq cycle rev prev rev next rev map path rel base map path map eq path mem2 map next map prev map fun base cycle arc arc arc rot left arc right arc rot to arc spec rot to arc,v_file
all_field,field,,0,,skipped
qfpoly,field,DomainDef monic_irreducible_poly qfpoly iDomain finIDomain Field mk_monicE coprimep_unit qpoly_mulVp qpoly_inv0 FinField card_qfpoly card_qfpoly_gt1 inPoly in_qpoly_comp_horner map_poly_div_inj finPoly qfpoly_const map_fpoly_div_inj Splitting qfpoly_splitting_field_type PrimitivePoly sh_gt1 primitive_poly primitive_polyP primitive_mi primitive_poly_in_qpoly_eq0 card_primitive_qpoly qX_neq0 qX_in_unit gX dvdp_order gX_order gX_all pred_card_qT_gt0 qlogp qlogp_lt qlogp_qX qX_order_card qX_order_dvd qlogp0 qlogp1 qlogp_eq0 qX_exp_neq0 qX_exp_inj powX_eq_mod qX_expK qlogpD Plogp plogp plogp_lt plogp_X plogp0 plogp1 plogp_div_eq0 plogpD,56,domain def monic irreducible poly qfpoly domain fin domain field mk monic coprimep unit qpoly mul vp qpoly inv0 fin field card qfpoly card qfpoly gt1 in poly in qpoly comp horner map poly div inj fin poly qfpoly const map fpoly div inj splitting qfpoly splitting field type primitive poly sh gt1 primitive poly primitive poly primitive mi primitive poly in qpoly eq0 card primitive qpoly qx neq0 qx in unit gx dvdp order gx order gx all pred card qt gt0 qlogp qlogp lt qlogp qx qx order card qx order dvd qlogp0 qlogp1 qlogp eq0 qx exp neq0 qx exp inj pow eq mod qx exp qlogp plogp plogp plogp lt plogp plogp0 plogp1 plogp div eq0 plogp,v_file
algnum,field,MoreAlgCaut alg_num_field rmorphZ_num fmorph_numZ algC_PET num_field_exists in_Crat_span Crat_span_subproof Crat_span Crat_spanP mem_Crat_span Crat_span_zmod_closed NumFieldProj Crat_spanZ Crat_spanM num_field_proj restrict_aut_to_num_field map_Qnum_poly restrict_aut_to_normal_num_field dec_Cint_span Cint_span Cint_spanP mem_Cint_span Cint_span_zmod_closed extend_algC_subfield_aut Qn_aut_exists Aint root_monic_Aint Cint_rat_Aint Aint_Cint Aint_int Aint0 Aint1 Aint_unity_root Aint_prim_root Aint_Cnat Aint_subring_exists AlgIntSubring fin_Csubring_Aint Aint_aut dvdA dvdA_zmod_closed eqAmod eqAmod_refl eqAmod_sym eqAmod_trans eqAmod_transl eqAmod_transr eqAmod0 eqAmodN eqAmodDr eqAmodDl eqAmodD eqAmodm0 eqAmodMr eqAmodMl eqAmodMl0 eqAmodMr0 eqAmod_addl_mul eqAmodM eqAmod_rat eqAmod0_rat eqAmod_nat eqAmod0_nat orderC exp_orderC dvdn_orderC,67,more alg caut alg num field rmorph num fmorph num alg pet num field exists in crat span crat span subproof crat span crat span mem crat span crat span zmod closed num field proj crat span crat span num field proj restrict aut to num field map qnum poly restrict aut to normal num field dec cint span cint span cint span mem cint span cint span zmod closed extend alg subfield aut qn aut exists aint root monic aint cint rat aint aint cint aint int aint0 aint1 aint unity root aint prim root aint cnat aint subring exists alg int subring fin csubring aint aint aut dvd dvd zmod closed eq amod eq amod refl eq amod sym eq amod trans eq amod transl eq amod transr eq amod0 eq amod eq amod dr eq amod dl eq amod eq amodm0 eq amod mr eq amod ml eq amod ml0 eq amod mr0 eq amod addl mul eq amod eq amod rat eq amod0 rat eq amod nat eq amod0 nat order exp order dvdn order,v_file
algC,field,Record Context nz2 mul2I sqrt sqrtK sqrtE i sqrMi iJ norm normK normE norm_eq0 normM normN le lt posE leB posP posJ pos_linear sposDl sposD normD Algebraics Type Implementation L conjL conjL_K conjL_nt L' cfType QtoL pQtoL rootQtoL eq_root eq_root_is_equiv eq_root_equiv type CtoL CtoL_inj CtoL_P LtoC_subproof LtoC LtoC_K CtoL_K zero add opp addA addC add0 addN CtoL_is_zmod_morphism CtoL_is_additive one mul inv mulA mulC mul1 mulD one_nz CtoL_is_monoid_morphism CtoL_is_multiplicative mulVf inv0 closedFieldAxiom conj_subproof conj_is_nmod_morphism conj_is_semi_additive conj_is_zmod_morphism conj_is_additive conj_is_monoid_morphism conj_is_multiplicative conj conjK conj_nt conjMixin algebraic archimedean isCountable divisor Internals algCi_subproof getCrat_spec getCrat_subproof minCpoly_subproof algC_divisor int_divisor nat_divisor Import algC algCeq algCzmod algCnzRing algCring algCuring algCnum algCfield algCnumField algCnumClosedField Creal getCrat Crat minCpoly nat_divisor int_divisor algC_divisor nCdivE zCdivE CdivE dvdC eqCmod HBExports AlgebraicsTheory intr_inj_ZtoC eqC_nat leC_nat ltC_nat Cpchar CratrE CintrE nz2 algC_algebraic algCrect algCreal_Re algCreal_Im dvdCP dvdCP_nat dvdC0 dvd0C dvdC_mull dvdC_mulr dvdC_mul2r dvdC_mul2l dvdC_trans dvdC_refl dvdC_zmod dvdC_nat dvdC_int eqCmod_refl eqCmodm0 eqCmod0 eqCmod_sym eqCmod_trans eqCmod_transl eqCmod_transr eqCmodN eqCmodDr eqCmodDl eqCmodD eqCmod_nat eqCmod0_nat eqCmodMr eqCmodMl eqCmodMl0 eqCmodMr0 eqCmod_addl_mul eqCmodM ratCK getCratK Crat_rat CratP Crat0 Crat1 Crat_divring_closed rpred_Crat conj_Crat Creal_Crat Cint_rat minCpolyP minCpoly_monic minCpoly_eq0 root_minCpoly size_minCpoly AutC aut_Crat Crat_aut algC_invaut_subproof algC_invaut algC_invautK algC_autK algC_invaut_is_zmod_morphism algC_invaut_is_additive algC_invaut_is_monoid_morphism algC_invaut_is_multiplicative minCpoly_aut Cchar algR total_algR algRval_is_zmod_morphism algRval_is_additive algRval_is_monoid_morphism algRval_is_multiplicative algR_norm algR_ler_normD algR_normr0_eq0 algR_normrMn algR_normrN Num withz z algR_addr_gt0 algR_ger_leVge algR_normrM algR_ler_def algR_archiFieldMixin algR_pfactor algC_pfactor algR_pfactorRE algC_pfactorRE algR_pfactorCE algC_pfactorCE algC_pfactorE size_algC_pfactor size_algR_pfactor algC_pfactor_eq0 algR_pfactor_eq0 algC_pfactorCgt0 algR_pfactorR_mul_gt0 monic_algC_pfactor monic_algR_pfactor poly_algR_pfactor algR_rcfMixin,228,record context nz2 mul2i sqrt sqrt sqrt sqr mi ij norm norm norm norm eq0 norm norm le lt pos le pos pos pos linear spos dl spos norm algebraics type implementation conj conj conj nt l' cf type qto qto root qto eq root eq root is equiv eq root equiv type cto cto inj cto lto subproof lto lto cto zero add opp add add add0 add cto is zmod morphism cto is additive one mul inv mul mul mul1 mul one nz cto is monoid morphism cto is multiplicative mul vf inv0 closed field axiom conj subproof conj is nmod morphism conj is semi additive conj is zmod morphism conj is additive conj is monoid morphism conj is multiplicative conj conj conj nt conj mixin algebraic archimedean is countable divisor internals alg ci subproof get crat spec get crat subproof min cpoly subproof alg divisor int divisor nat divisor import alg alg ceq alg czmod alg cnz ring alg cring alg curing alg cnum alg cfield alg cnum field alg cnum closed field creal get crat crat min cpoly nat divisor int divisor alg divisor cdiv cdiv cdiv dvd eq cmod hb exports algebraics theory intr inj zto eq nat le nat lt nat cpchar cratr cintr nz2 alg algebraic alg crect alg creal re alg creal im dvd cp dvd cp nat dvd c0 dvd0c dvd mull dvd mulr dvd mul2r dvd mul2l dvd trans dvd refl dvd zmod dvd nat dvd int eq cmod refl eq cmodm0 eq cmod0 eq cmod sym eq cmod trans eq cmod transl eq cmod transr eq cmod eq cmod dr eq cmod dl eq cmod eq cmod nat eq cmod0 nat eq cmod mr eq cmod ml eq cmod ml0 eq cmod mr0 eq cmod addl mul eq cmod rat ck get crat crat rat crat crat0 crat1 crat divring closed rpred crat conj crat creal crat cint rat min cpoly min cpoly monic min cpoly eq0 root min cpoly size min cpoly aut aut crat crat aut alg invaut subproof alg invaut alg invaut alg aut alg invaut is zmod morphism alg invaut is additive alg invaut is monoid morphism alg invaut is multiplicative min cpoly aut cchar alg total alg alg rval is zmod morphism alg rval is additive alg rval is monoid morphism alg rval is multiplicative alg norm alg ler norm alg normr0 eq0 alg normr mn alg normr num withz alg addr gt0 alg ger le vge alg normr alg ler def alg archi field mixin alg pfactor alg pfactor alg pfactor re alg pfactor re alg pfactor ce alg pfactor ce alg pfactor size alg pfactor size alg pfactor alg pfactor eq0 alg pfactor eq0 alg pfactor cgt0 alg pfactor mul gt0 monic alg pfactor monic alg pfactor poly alg pfactor alg rcf mixin,v_file
